summary,pros,cons,review_date,job_title,rating_overall,rating_work_life_balance,rating_compensation_and_benefits,rating_career_opportunities,rating_culture_and_values,rating_diversity_and_inclusion,rating_senior_leadership,rating_recommend_to_friend,rating_business_outlook,overall_rating,compensation_and_benefits_rating,culture_and_values_rating,diversity_and_inclusion_rating
organized chaos leads to a brighter career,"Good coverage of different technologies. i heard good things about them and experienced it myself. people previously who were unable to find jobs in startups after getting experience with synergisticit got offers from apple, paypal, intel .

good place for people with basic understanding of programming in java or any other language and people with experience. If you dont know any programming dont join as you will have a hard time as there is projects which you have to do etc and a solid foundation is needed in basic programming.

 if you have a good foundation are a good student i assure you they will make you succeed. I have seen average pay rates after working with them something in the range of 75k to as high as 130k i guess that also depends if you had previous experience how well you present yourself and stuff.

 They work with you and the manger is also supportive and would tell you things good for you but you might not like them. If you are rude you will be called out, dont come to office same. You can do projects remotely also as long as you do are regular and dont miss days.

I am pleased to say that i was able to get couple of offers within 3 week of finishing my projects with them and they putting me into the market. I after 5 months know almost 3 times more than my peers before i joined synergisticit what they told me that what you learn here in 5 months people take 4-5 years to learn is almost true to a certain extent. 

I am witness to one person who used to drive uber to supplement his income and after working with synergisticit he is working for paypal now and getting 100+k. To anyone thinking about coming over to them just have confidence work hard and stay positive and be regular and i promise you that very soon you will be working at a great client and will have multiple offers rather than just one. 
I am living proof for the above. Anyone needs any answers message me here and i will try to answer. It took me 4 months to write this review and it was long due and i guess i owed them this. 

Was giving 4 stars but decided for 5 stars as even though they are not structured the end result is what counts and that was me getting more stronger technically and me in being demand by multiple clients. I wish good luck to everyone.. god bless",there is no planned structure only in the end all the pieces come together. Duration is pretty long as much as 4-5 months but i feel the topics covered are so many that it makes sense that it takes that much time. Good for people with basic knowledge and experienced people with no US experience . People who dont know coding will have tough time and will have to work long hours to compete,2018-09-14T12:55:19.843,Java Backend Programmer,5,3,4,5,5,0,4,POSITIVE,POSITIVE,4.1,4.1,4.1,4.3
